RowIndex,Old_Total,New_Total,Old_ObjectNames,New_ObjectNames,Old_Makers,New_Makers,Old_Organisations/Institutions,New_Organisations/Institutions,Old_Dates,New_Dates,Old_Places,New_Places,Old_Descriptions,New_Descriptions,Old_Other,New_Other,Unique_to_Old,Unique_to_New
193,23,10,1,1,1,1,0,1,1,1,1,3,18,2,1,1,"{""object_names"": [""TRAVELLER'S THEODOLITE""], ""makers"": [""Robinson, London""], ""organisations/institutions"": [], ""dates"": [""middle of the 19th century""], ""places"": [""London""], ""descriptions"": [""highly compact transit theodolite"", ""vertical and horizontal circles of diameter 3.5 in."", ""graduated in half-degrees and read by vernier to single minutes"", ""rests on three levelling screws, which can be fitted within three V-shaped notches in the top of the case"", ""horizontal circle is fixed to the tribrach, which carries a supplementary telescope, tangential to the circle, for keeping the back station in view"", ""single central standard projects vertically from the horizontal circle, and serves as an axis for the hollow cylinder which carries the vernier bracket for the horizontal axis at its lower extremity, and a bracket to which is fixed the vertical circle at its upper end"", ""telescope is fixed to an arm carrying opposing verniers for the vertical circle, and can rotate with this arm about a horizontal axis through the top of the standard"", ""spirit level is attached to the back of the vertical circle, at right angles to the standard"", ""tangent clamps and slow-motion screws are fixed to the vernier brackets of both circles"", ""magnifying lenses for facilitating the reading of the vernier"", ""three verniers to the horizontal circle, symmetrically disposed round its circumference"", ""vertical circle has two verniers at opposite ends of a diameter"", ""main and supplementary telescopes are of equal size and power"", ""objectives have a focal length of 3.5 in., and a clear aperture of 0.6 in."", ""slide in the telescope tubes for focussing"", ""eyepieces are of the Ramsden type"", ""diaphragms fitted with cross wires are fixed inside the telescope tubes"", ""one on the main telescope has two vertical wires and one horizontal wire"", ""diagonal eyepiece is provided for taking steep sights"", ""telescope is slightly eccentric to the vertical standard, a counterpoise to balance its weight is fitted on the standard""], ""other"": [""Lent by T. H. Court, Esq.""]}","{""object_names"": [""Portable transit theodolite"", ""Surveying transit theodolite""], ""makers"": [""Thomas Charles Robinson""], ""organisations/institutions"": [""Science Museum Group""], ""dates"": [""1823-1841""], ""places"": [""City of Westminster, London, Greater London, England, United Kingdom"", ""Portland Place, London, England""], ""descriptions"": [""with case and accessories"", ""Portable 'travellers' transit theodolite""], ""other"": [""British""]}"
194,26,9,2,2,1,1,1,0,2,1,1,3,15,1,4,1,"{""object_names"": [""TRANSIT THEODOLITE""], ""makers"": [""O. Fennel""], ""organisations/institutions"": [""Science Museum Group""], ""dates"": [""about 1875"", ""1875""], ""places"": [""Cassel""], ""descriptions"": [""horizontal circle has a separate axis with clamps and tangent screw for repeating angles, and is covered by a metal plate attached to the vernier plate"", ""horizontal circle diameter of 14 cm."", ""horizontal circle graduated every 20' and read by opposing verniers and reading microscopes to 20\"""", ""reversible level fixed to the telescope has its upper and lower faces used before and after this is transited"", ""circular metal footplates attached to the extremities of the footscrews by ball and socket joints are peculiar to German instruments"", ""allow the theodolite to be moved over the surface of the tripod head for centring, which movement is permitted by the special arrangement for connecting the instrument and tripod"", ""vertical circle has a diameter of 12 cm."", ""vertical circle graduated in half-degrees and read by a single vernier to minutes"", ""vertical circle is rigidly fixed to the transit axis and telescope"", ""fixed objective of 22-cm. focal length and 3-cm. aperture"", ""rack-focussing eyepiece tube, carrying the fixed diaphragm and a slide-focussing inverting eyepiece"", ""reversible level is attached by adjustable screws parallel to the axis of the telescope"", ""Any error in adjustment between the level and telescope is automatically corrected by transiting the telescope and again levelling it after rotation horizontally through 180\u00b0"", ""axis clamp and tangent screw for fine vertical motion is attached to one standard, the V-bearing or the axis being adjustably vertically"", ""axis is kept in the bearings by metal straps"", ""small circular spirit level, for roughly setting the plate horizontal, the final levelling being tested by the spirit level attached to the telescope"", ""vernier plate has a clamp and tangent screw in addition to that on the horizontal circle"", ""tribrach mounting, with three levelling screws"", ""connected to the tripod head by a central screw and spring"", ""On loosening this the theodolite can be moved laterally for centring above the station point""], ""other"": [""Inv. 1876-1193""]}","{""object_names"": [], ""makers"": [""Fennel, Otto""], ""organisations/institutions"": [], ""dates"": [""1875""], ""places"": [""Kassel, Hesse, Germany""], ""descriptions"": [""Surveying repeating theodolite""], ""other"": []}"
195,22,6,2,2,1,2,1,0,1,1,1,0,13,1,3,0,"{""object_names"": [""TRANSIT THEODOLITE""], ""makers"": [""A. & R. Hahn""], ""organisations/institutions"": [""Science Museum Group""], ""dates"": [""about 1875""], ""places"": [""Cassel""], ""descriptions"": [""repeating theodolite"", ""resembles the adjacent one by Fennel in general construction"", ""differs, however, in having an ordinary one-sided spirit level attached to the telescope"", ""telescope has also a Huygens, not a Ramsden, eyepiece"", ""horizontal circle has a diameter of 14 cm., is graduated every 20' and read by two opposing verniers and reading microscopes to 30\"""", ""vertical circle, of 10.5 cm. diam., is divided to 30' and read by opposing verniers to single minutes"", ""telescope has a fixed objective, of 2.5 cm. clear aperture and with the field lens of the eyepiece, a focal length of 23 cm."", ""eyepiece is focussed by a rack and pinion arrangement, the cross-wire diaphragm being fixed between the two lenses"", ""telescope, rigidly attached to the horizontal axis and the vertical circle, transits at the eyepiece end"", ""telescope has a sensitive longitudinal spirit level mounted on it in adjustable bearings"", ""vertical vernier bracket is screwed to one standard, whilst the other carries the tangent screw and clamping spring for the transit axis"", ""horizontal vernier plate carries a metal cover which protects the horizontal circle and supports a central circular spirit level, and the reading microscopes"", ""There are windows in this plate above the verniers, and reflectors are attached to the microscopes for illuminating the field"", ""horizontal circle has a separate axis, with clamp and tangent screw for repetition"", ""fits in the socket fixed to the tribrach, which has three levelling screws furnished at their feet with small metal plates, to which they are connected by ball and socket joints"", ""instrument is connected to its tripod by the usual German central screw, with a flange and opposing spring which fix the instrument tightly, but on loosening the screw permit the theodolite to be displaced laterally for accurate centring over the station point""], ""other"": [""Inv. 1876-1192"", ""Fennel"", ""14 cm.""]}","{""object_names"": [], ""makers"": [""Hahn, R. (maker)""], ""organisations/institutions"": [], ""dates"": [], ""places"": [], ""descriptions"": [""Surveying theodolite circles""], ""other"": [""10.5cm"", ""1875""]}"
196,29,10,1,1,1,1,0,1,1,1,1,3,18,2,7,1,"{""object_names"": [""TRANSIT THEODOLITE""], ""makers"": [""Dennert & Pape""], ""organisations/institutions"": [], ""dates"": [""about 1875""], ""places"": [""Altona""], ""descriptions"": [""The horizontal circle and vernier plate in this instrument, which was constructed about 1875, have independent motions about the vertical axis, for repeating azimuth angles."", ""Clamps and tangent screws are provided for both circles, and for the vertical circle."", ""The horizontal and vertical circles have diameters 21 and 13 cm. respectively, are both covered, divided to 10' and read by opposing verniers and reading microscopes to 10\""."", ""The telescope is mounted centrally on the horizontal axis, and can transit at either end."", ""It has a fixed objective of aperture 3.5 cm. and focal length 25 cm., and a rack-focussing eyepiece tube, carrying a fixed cross-wire diaphragm and a screw-focussing inverting eyepiece."", ""A sensitive spirit level is mounted in adjustable bearings longitudinally above the telescope, and another is fixed at right angles to this on the vernier plate, between the standards."", ""The vertical circle is fixed to the telescope and transit axis, the vernier plate being fixed to one standard, and an axis clamp and tangent screw to the other."", ""The trunnions on both standards are adjustable vertically."", ""The instrument has a tribrach mounting, with three footscrews for levelling."", ""These screws have flat ball and socket jointed footplates which rest on the tripod head."", ""The attachment for fixing the theodolite to the tripod is the central screw and spring usual in German instruments, which permits a lateral adjustment of the theodolite over the station point without moving the tripod.""], ""other"": [""Inv. 1876-1194"", ""horizontal circle"", ""vernier plate"", ""vertical axis"", ""vertical circle"", ""horizontal"", ""vertical""]}","{""object_names"": [""Surveyor's transit theodolite""], ""makers"": [""Dennert and Pape""], ""organisations/institutions"": [""Science Museum Group""], ""dates"": [""1876""], ""places"": [""Hamburg, Germany"", ""Altona, Hamburg, Hamburg, Germany""], ""descriptions"": [""Surveying transit theodolite""], ""other"": [""23-cm""]}"
197,23,7,1,1,1,1,0,1,1,1,1,0,18,1,1,2,"{""object_names"": [""TRANSIT THEODOLITE""], ""makers"": [""J. Wanschaff""], ""organisations/institutions"": [], ""dates"": [""about 1875""], ""places"": [""Berlin""], ""descriptions"": [""constructed about 1875"", ""has the telescope and vertical circle fixed at opposite extremities of the horizontal axis, outside the bearings."", ""This arrangement reduces the height of the instrument and permits the telescope to transit completely, but has the disadvantage that the telescope is not centred above the station point."", ""The horizontal circle has a diameter of 16 cm., is divided to 10' and read by opposing verniers and reading microscopes to 10\""."", ""It is covered by a metal plate attached above the vernier plate, and fits fairly tightly on the vertical axis, but can be rotated independently for taking readings of an azimuth angle at various parts of the limb."", ""The vernier plate has an axis clamp and tangent screw, and carries a central socket in which the vertical axis rotates."", ""A horizontal bracket fixed across the top of this socket carries the bearings for the transit axis."", ""Both bearings can be adjusted on the bracket, and tested for horizontality by a sensitive striding level."", ""The transit axis has a clamp and slow-motion screw to fix it to the vertical socket."", ""The vertical circle has a diameter of 10\u00b75 cm., is divided to 20' and reads by opposing verniers fixed to the axis bracket and magnifying lenses to 1'."", ""The telescope has a fixed objective of 2\u00b75-cm. aperture and 22-cm. focal length, and a rack-focussing eyepiece tube carrying a fixed cross-wire diaphragm and a slide-focussing inverting eyepiece."", ""The instrument is mounted on a tribrach, with three footscrews."", ""telescope"", ""vertical circle"", ""horizontal axis"", ""bearings"", ""horizontal circle"", ""vernier plate"", ""vertical axis"", ""transit axis"", ""vertical circle"", ""telescope"", ""objective"", ""eyepiece tube"", ""diaphragm"", ""eyepiece"", ""tribrach""], ""other"": [""Inv. 1876-1195""]}","{""object_names"": [""Theodolite""], ""makers"": [""Wanschaff, J.""], ""organisations/institutions"": [""Science Museum Group""], ""dates"": [""1876""], ""places"": [], ""descriptions"": [""Surveying theodolite""], ""other"": [""circles of 6 and 4 inches"", ""spring fastening for plummet"", ""Spirit level for the above""]}"
198,29,12,1,1,1,1,1,2,1,1,0,4,19,2,3,1,"{""object_names"": [], ""makers"": [], ""organisations/institutions"": [""Admiralty""], ""dates"": [], ""places"": [], ""descriptions"": [""7-in. vertical and horizontal circles, graduated every 10' and reading by two opposing verniers and reading microscopes to 10\"""", ""All adjustable screws and parts are covered with wash leather to protect the operator's fingers from frost."", ""The horizontal and alidade circles are enclosed in a metal case, the verniers being covered by hinged plates."", ""Clamps and tangent screws are fitted to both circles, and to the vertical circle, which is not covered, and is fixed to the transit axis."", ""The vertical vernier bracket is clamped to a lug on one standard by opposing screws, and carries a sensitive spirit level perpendicular to the transit axis."", ""The transit axis rests in Y-bearings on the standards, one trunnion being adjustable vertically, and is kept in position by metal retaining straps; it is hollow and has a lens at one end for illuminating the telescope axis."", ""The telescope is rigidly fixed to this axis and transits at the eyepiece end only."", ""It has an objective of 11-in. focal length and 1\u00b75-in. aperture, focussed by a rack and pinion mechanism controlled from the eyepiece end."", ""The diaphragm has one vertical and one horizontal thread, both adjustable laterally."", ""Three slide focussing eyepieces are provided, one inverting, one diagonal, and one erecting."", ""There is a central reflector in the telescope for illuminating its axis by light coming through the transit axis from a lamp fixed to one standard."", ""A striding level is provided for testing the transit axis."", ""The vernier cover plate carries a spirit level, with its axis parallel to the transit axis, whilst a perpendicular level is fixed to one standard."", ""A central compass with a 4-in. ring graduated in degrees is attached to the vernier plate."", ""The instrument has a tribrach mounting with three levelling footscrews, whose points rest in a trivet plate; this is provided with a locking plate of the Everest type attached to the tripod head.""], ""other"": [""Inv. 1911-161"", ""made at the end of the 19th century"", ""used in the British Antarctic Expedition, 1901""]}","{""object_names"": [], ""makers"": [], ""organisations/institutions"": [""Hydrographic Office"", ""British Admiralty""], ""dates"": [], ""places"": [""30 Strand, London, England"", ""Strand, City of Westminster, London, England, United Kingdom""], ""descriptions"": [""Surveying transit theodolite""], ""other"": [""1876-1900"", ""fitted with leather covers on knobs and exposed metal fittings"", ""Originally property of the Hydrographic Office, British Admiralty""]}"
199,30,9,1,2,1,1,0,1,1,1,0,3,15,1,2,0,"{""object_names"": [], ""makers"": [], ""organisations/institutions"": [], ""dates"": [], ""places"": [], ""descriptions"": [""compact theodolite specially designed for Alpine and military surveying"", ""3-in. vertical and horizontal circles"", ""divided to half-degrees"", ""read by verniers to single minutes"", ""diagonal eyepiece is provided for astronomical observations of stars near the zenith"", ""construction of the instrument is similar to that of a modern vernier theodolite of twice the size"", ""transit axis rests on standards projecting from the vernier plate"", ""carries a central telescope and the vertical circle fixed to it"", ""vernier arm projects from one standard"", ""tangent clamp and slow-motion screw is fitted to the other"", ""carries a spirit level perpendicular to the transit axis"", ""similar level parallel to the transit axis is fixed on the vernier plate"", ""carries a central compass box"", ""having a 1-in. ring divided in degrees"", ""compass needle is provided with a lifting lever for clamping it when desired"", ""vernier plate rotates independently about the vertical axis"", ""has a clamp and tangent screw for connecting it to the horizontal circle"", ""similar clamp and tangent screw connecting it to the tribrach"", ""tribrach has three footscrews"", ""footscrews with their feet clamped in a trivet plate by a locking plate of the Everest type"", ""trivet plate can be screwed to the tripod head"", ""telescope has a rack-focussing objective"", ""objective of 4\u00b75-in. focal length"", ""objective of 0\u00b765-in. aperture"", ""fixed cross-wire diaphragm"", ""set of slide-focussing eyepieces"", ""one erecting eyepiece"", ""one inverting eyepiece"", ""one diagonal eyepiece"", ""reflector for illuminating the cross wires at night is fitted in front of the objective""], ""other"": [""Inv. 1893-147"", ""3-in.""]}","{""object_names"": [""Surveying transit theodolite"", ""transit theodolite 1892""], ""makers"": [], ""organisations/institutions"": [""Science Museum Group""], ""dates"": [], ""places"": [""Holborn, London, England"", ""United Kingdom""], ""descriptions"": [""3 inch""], ""other"": []}"
200,11,14,1,4,1,1,1,1,1,1,2,3,4,2,1,2,"{""object_names"": [""ENGINEER'S TRANSIT THEODOLITE""], ""makers"": [], ""organisations/institutions"": [], ""dates"": [], ""places"": [""Troy, New York""], ""descriptions"": [""illustrates many of the characteristics of modern American transit theodolites of the type used in reconnaissance and engineering surveying"", ""The solar attachment to the telescope for determining meridians and latitudes by observations on the sun is a special feature"", ""the levelling base, with its \""shifting centre\"" and four footscrews, is typical of American construction""], ""other"": [""Inv. 1914-741""]}","{""object_names"": [""Transit theodolite"", ""Engineer's transit theodolite"", ""Surveying transit theodolite""], ""makers"": [], ""organisations/institutions"": [], ""dates"": [""1911-1920""], ""places"": [""United States"", ""Troy, New York state""], ""descriptions"": [""American"", ""6.5-inch"", ""Fitted with Burt type solar attachment and accessories""], ""other"": [""Troy, New York state, United States W. & L. E. Gurley""]}"
201,18,4,1,1,1,0,1,1,1,0,0,0,12,1,3,1,"{""object_names"": [], ""makers"": [""C. F. Casella & Co., Ltd.""], ""organisations/institutions"": [], ""dates"": [""1921-732""], ""places"": [], ""descriptions"": [""5-in. vernier theodolite of modern construction"", ""telescope having a fixed objective and internal focussing lens"", ""gradienter scale is fitted to the clamp of the vertical circle"", ""used for measuring distances"", ""4 in. is divided to 20' and read by opposing verniers and microscopes to 30\"""", ""sensitive spirit level is fixed to the vernier bracket, perpendicular to the transit axis"", ""telescope has a fixed objective of 1.25 in. aperture"", ""internal lens, movable for focussing by means of a central screw operating the rack and pinion"", ""screw is conveniently placed at one end of the transit axis"", ""eyepiece is inverting, screw focussing and magnifies 20 diam."", ""diaphragm, which is fixed in the main telescope tube and is of the star pattern, with one horizontal and two equally inclined wires intersecting on the former"", ""gradienter scale is fixed to the clamping bracket of the vertical circle, the head of the tangent screw having a graduated drum reading hundredths of the scale divisions, each of which is one-hundredth of the distance between the transit axis and the axis of the tangent screw"", ""In using the scale for measuring distances, the altitude introduces a factor depending on the square of its cosine"", ""instrument has a tribrach mounting with three levelling screws, the feet of which rest in grooves in a trivet stage and are kept fixed by a locking plate"", ""knurled clamping screw serves to fix this stage to the tripod head, permitting a small centring movement without disturbing the tripod""], ""other"": [""fixed objective"", ""internal focussing lens"", ""internal lens""]}","{""object_names"": [], ""makers"": [], ""organisations/institutions"": [], ""dates"": [], ""places"": [], ""descriptions"": [""A precise instrument for measuring angles and determining positions.""], ""other"": [""inventory number""]}"
202,22,5,1,1,1,0,1,1,1,0,0,0,14,3,5,0,"{""object_names"": [""VERNIER TRANSIT THEODOLITE""], ""makers"": [""E. R. Watts & Son, Ltd.""], ""organisations/institutions"": [""Science Museum Group""], ""dates"": [""1922""], ""places"": [], ""descriptions"": [""4.6-in. horizontal circle"", ""4-in. vertical circle"", ""divided on silver to 20'"", ""read by two opposing verniers and reading microscopes to 20\"""", ""internal focussing lens"", ""transits at both ends"", ""horizontal circle enclosed in a dustproof and waterproof box"", ""fixed to the vernier plate"", ""theodolite is clamped to the levelling tribrach by a centring device"", ""vertical axis can be set over the station point without moving the tribrach and tripod"", ""fixed objective of 1.7 in. aperture"", ""fixed glass diaphragm"", ""usual cross lines and stadia lines"", ""anallatic properties of the internal focussing lens"", ""no \""constant\"" is necessary when using the theodolite as a tacheometer"", ""eyepiece is inverting and screw focussing"", ""transit axis"", ""permanently fixed on the standards"", ""bearing at one end can be adjusted by means of a capstan screw"", ""horizontal circle is mounted on a repeating stage"", ""separate axis clamp and tangent screw"", ""vertical vernier bracket is fixed adjustably to the standard"", ""usual spirit level with its axis parallel to the vernier zeros"", ""similar bubble tube is mounted on the horizontal plate, parallel to the transit axis"", ""very small bubble is fixed across one standard, perpendicular to the transit axis"", ""trough compass"", ""usual edge-bar needle and lifting arrangement"", ""screwed across the other standard"", ""can be detached if required"", ""feet of the three levelling foot-screws are tightly clamped in a trivet stage"", ""screws on the tripod head"", ""pointed feet for setting it on a platform when the tripod is not necessary"", ""heads of the footscrews have dustproof caps, threaded in the tribrach"", ""also serve to take up any wear on the footscrews"", ""graduation of the circles and the numbering of the divisions at every 5\u00b0 are very distinct""], ""other"": [""Inv. 1922-444"", ""lent by E. R. Watts & Son, Ltd."", ""4.6-in."", ""4-in."", ""20'"", ""20\"""", ""1.7 in.""]}","{""object_names"": [], ""makers"": [], ""organisations/institutions"": [], ""dates"": [], ""places"": [], ""descriptions"": [""transit theodolite"", ""horizontal circle diameter: 4.6 inches"", ""vertical circle diameter: 4 inches""], ""other"": []}"
