RowIndex,Old_Total,New_Total,Old_ObjectNames,New_ObjectNames,Old_Makers,New_Makers,Old_Organisations/Institutions,New_Organisations/Institutions,Old_Dates,New_Dates,Old_Places,New_Places,Old_Descriptions,New_Descriptions,Old_Other,New_Other,Unique_to_Old,Unique_to_New
0,12,0,1,0,1,0,1,0,1,0,0,0,7,0,1,0,"{""object_names"": [""DIAGRAM OF TRIANGULATION MARKS OF THE ORDNANCE SURVEY""], ""makers"": [""Museum""], ""organisations/institutions"": [""ORDNANCE SURVEY""], ""dates"": [""1920-388""], ""places"": [], ""descriptions"": [""primary (first order) triangulation stations"", ""marked by means of a gun-metal bolt let into a block of concrete 2-ft. cube"", ""exact point is indicated by a small hole drilled in the top of the bolt, which is protected by an iron cover"", ""top of the block is at least two feet below the surface of the ground, except when set in solid rock"", ""cairn is built over the point when circumstances allow"", ""secondary triangulation stations are marked in the same way, except that the dimensions of the block, bolt and cover are all less than in the case of the primary stations"", ""tertiary stations are marked in the same way as permanent traverse stations"", ""brass bolt, having a cylindrical hole 7/16ths of an inch diameter drilled in its top"", ""cemented into a 30-in. iron socket, which is rammed into the ground until it is from 9 to 12 in. beneath the ground surface and then filled with concrete""], ""other"": [""Inv.""]}","{""object_names"": [], ""makers"": [], ""organisations/institutions"": [], ""dates"": [], ""places"": [], ""descriptions"": [], ""other"": []}"
1,13,1,1,0,1,0,1,1,1,0,2,0,6,0,1,0,"{""object_names"": [""DIAGRAM OF TRAVERSE MARK OF THE ORDNANCE SURVEY""], ""makers"": [""Made in the Museum""], ""organisations/institutions"": [""Ordnance Survey""], ""dates"": [""1920-386""], ""places"": [""Egypt"", ""towns""], ""descriptions"": [""To provide additional points for the control of the detailed survey, traverse lines are run between third or fourth order triangulation points with a theodolite by which, at each change of direction of the traverse line (traverse point), the azimuth of the forward line is measured."", ""All such traverse points in towns are now marked by means of a brass bolt, into the top of which can be fitted the 15-in. observing rod or the foot of the traverse pole."", ""For temporary marks the bolts are cemented into the curb of the pavement."", ""For permanent marks a 30-in. iron socket, similar to the base of an iron telegraph pole (Figs. 1 and 2) is rammed into the ground till the top is 9 to 12 in. below the surface."", ""The socket is filled with cement or concrete, and the bolt cemented in at the top."", ""The number of points so marked varies according to the nature of the survey. In some continental cadastral surveys the average number is 20 to 50 per square kilometre in the country, and 100 to 150 in towns. In the highly cultivated land of Egypt where holdings are small but the land is level and unobstructed by hedges, about 16 to 20 per square kilometre are used.""], ""other"": [""Figs. 1 and 2""]}","{""object_names"": [], ""makers"": [], ""organisations/institutions"": [""Science Museum Group""], ""dates"": [], ""places"": [], ""descriptions"": [], ""other"": []}"
2,9,8,1,1,0,1,2,1,1,1,0,1,4,2,1,1,"{""object_names"": [""TRAVERSE MARK BOLT AND COVER""], ""makers"": [], ""organisations/institutions"": [""Ordnance Survey""], ""dates"": [], ""places"": [], ""descriptions"": [""A cylindrical hole 7/16ths in. diam. is drilled in the head of the bolt into which the 15-in. observing rod or the foot of the traverse pole can be fitted."", ""The bolt is protected by an iron cap or hydrant cover according to the nature of the surface."", ""An observing pin and small circular spirit level for setting it vertical are also shown.""], ""other"": [""Inv. 1914-154""]}","{""object_names"": [""Traverse mark, bolt and cover""], ""makers"": [""Unknown maker""], ""organisations/institutions"": [""British Ordnance Survey""], ""dates"": [""1910-1914""], ""places"": [""United Kingdom""], ""descriptions"": [""Surveying bench mark; bench mark""], ""other"": [""unsigned"", ""British""]}"
3,8,8,1,1,0,1,1,1,1,1,1,1,3,1,1,2,"{""object_names"": [""BRONZE TRIANGULATION MARK""], ""makers"": [], ""organisations/institutions"": [""French Government""], ""dates"": [""1914""], ""places"": [""France""], ""descriptions"": [""This type of mark set either in rock or masonry is used for marking the first order triangulation stations in France."", ""It consists of a small cylindrical bronze bolt with grooved sides and a cross engraved on its upper face, the intersection of the cross indicating the station point."", ""first order triangulation stations""], ""other"": [""Inv. 1914-107""]}","{""object_names"": [""Bronze triangulation mark""], ""makers"": [""Unknown maker""], ""organisations/institutions"": [""First Order Triangulation of France""], ""dates"": [""1910-1914""], ""places"": [""French""], ""descriptions"": [""Surveying triangulation mark""], ""other"": [""unsigned"", ""triangulation mark 1910-1914 France""]}"
4,8,11,1,3,0,1,1,1,1,1,1,2,3,3,1,0,"{""object_names"": [""NAME-PLATE FOR TRIANGULATION MARK""], ""makers"": [], ""organisations/institutions"": [""French Government""], ""dates"": [], ""places"": [""France""], ""descriptions"": [""This elliptical metal plate is fixed in masonry at a first order triangulation station in France, and carries a number corresponding to the particular station point.""], ""other"": [""Inv. 1914-108""]}","{""object_names"": [""Triangulation mark"", ""station mark name plate"", ""Surveying triangulation mark""], ""makers"": [""Unknown maker""], ""organisations/institutions"": [""First Order Nivellement General de la France""], ""dates"": [], ""places"": [""France""], ""descriptions"": [""French"", ""Brass (?)"", ""unsigned"", ""triangulation mark 1914 France""], ""other"": []}"
5,8,8,1,2,1,1,1,1,1,1,0,1,3,1,1,1,"{""object_names"": [], ""makers"": [], ""organisations/institutions"": [], ""dates"": [], ""places"": [], ""descriptions"": [""consists of a brass disc and shank cast in one piece"", ""The shank is ribbed so as to grip securely the material\u2014generally rock or concrete\u2014in which the mark is set"", ""One such mark is set at the surface and a similar one about 3 ft. directly underneath it at every triangulation station""], ""other"": [""Inv. 1920-81""]}","{""object_names"": [""Triangulation Station Mark""], ""makers"": [""Unknown maker""], ""organisations/institutions"": [], ""dates"": [], ""places"": [""United States""], ""descriptions"": [""Surveying triangulation mark; triangulation mark""], ""other"": [""Bronze""]}"
6,12,8,1,2,1,1,2,1,1,1,1,1,5,2,1,0,"{""object_names"": [], ""makers"": [], ""organisations/institutions"": [""U.S. Coast and Geodetic Survey Special Publication No. 26""], ""dates"": [], ""places"": [], ""descriptions"": [""older form of station mark"", ""shank is split so that a wedge can be inserted"", ""wedge causes the shank to bulge and grip firmly the surrounding material"", ""station point is defined by a dot enclosed in two intersecting 20-mm. equilateral triangles engraved on the disc""], ""other"": [""See U.S. Coast and Geodetic Survey Special Publication No. 26, p. 42.""]}","{""object_names"": [""Magnetic Station Mark""], ""makers"": [], ""organisations/institutions"": [], ""dates"": [], ""places"": [], ""descriptions"": [""Surveying station mark""], ""other"": []}"
7,10,7,1,2,1,1,2,1,1,1,0,1,4,1,1,0,"{""object_names"": [""HYDROGRAPHIC STATION MARK""], ""makers"": [], ""organisations/institutions"": [""U.S. Coast and Geodetic Survey""], ""dates"": [], ""places"": [], ""descriptions"": [""This mark is the same as that used for triangulation station marks, except that the central hole or dot is here surrounded by a 2.5-cm. circle."", ""The mark is set in a post or block of concrete, or wedged into a drill-hole in rock, after which a triangle or circle is chiselled round it."", ""For underground station marks a similar disc is set 3 ft. below ground in a block of concrete, in rock or other suitable material."", ""See U.S. Coast and Geodetic Survey Special Publication No. 26, pp. 42\u201343.""], ""other"": [""Inv. 1920-78""]}","{""object_names"": [""Hydrographic station mark"", ""Surveying station mark; station mark""], ""makers"": [""brass""], ""organisations/institutions"": [""United States Coast and Geodetic Survey""], ""dates"": [""c. 1920""], ""places"": [""United States""], ""descriptions"": [""Surveying station mark""], ""other"": []}"
8,9,6,1,2,0,0,1,1,1,1,0,0,5,2,1,0,"{""object_names"": [""reference mark""], ""makers"": [], ""organisations/institutions"": [], ""dates"": [], ""places"": [], ""descriptions"": [""used to facilitate the recovery of station marks, especially where these are liable to damage or disturbance"", ""placed so that the arrow engraved thereon points to the station mark"", ""horizontal distance between the station mark and the groove cut across the shaft of the arrow is recorded"", ""set in concrete posts or blocks, or in rock, at distances up to 20 yd. from the station marks"", ""(See U.S. Coast and Geodetic Survey Special Publication No. 26, pp. 42\u201343.)""], ""other"": [""Inv. 1920-77""]}","{""object_names"": [""Standard Reference mark"", ""Surveying reference mark""], ""makers"": [], ""organisations/institutions"": [], ""dates"": [], ""places"": [], ""descriptions"": [""brass"", ""reference mark 1920""], ""other"": []}"
9,10,8,1,2,0,1,1,1,1,1,1,1,5,2,1,0,"{""object_names"": [""TRIANGULATION STATION MARK""], ""makers"": [], ""organisations/institutions"": [""Geodetic Survey of Canada""], ""dates"": [""1922""], ""places"": [""Canada""], ""descriptions"": [""Stations of the Primary Triangulation of Canada are marked by means of circular metal bolts of the type exhibited, the bolts being embedded in concrete or leaded into rock. Both underground and surface marks are employed, and reference monuments provided to facilitate recovery of the station. The bolt consists of a 3-in. circular bronze disc, attached to a 3-in. cylindrical shank, which is corrugated and fox-wedged so that the shank expands tightly against the sides of the hole drilled to receive it when the bolt is driven in. The centre of the disc has a triangle engraved upon it, with a central hole punched to define the exact station point.""], ""other"": [""Inv. 1922-726""]}","{""object_names"": [""Bronze triangulation station mark"", ""Surveying triangulation mark; triangulation mark""], ""makers"": [""Unknown maker""], ""organisations/institutions"": [""Geodetic Survey of Canada""], ""dates"": [""1920""], ""places"": [""Canada""], ""descriptions"": [""Canadian""], ""other"": []}"
10,9,11,1,3,0,1,1,1,1,1,1,1,4,3,1,1,"{""object_names"": [""REFERENCE MARK""], ""makers"": [], ""organisations/institutions"": [""Geodetic Survey of Canada""], ""dates"": [""1922""], ""places"": [""Canada""], ""descriptions"": [""station marks of the Primary Triangulation of Canada"", ""set in outstanding rocks or in concrete monuments"", ""three such marks are set approximately 120\u00b0 apart around the station"", ""has an arrow engraved upon it to indicate the direction in which the station point lies""], ""other"": [""Inv. 1922-724""]}","{""object_names"": [""triangulation station mark"", ""Surveying triangulation mark"", ""triangulation mark""], ""makers"": [""Unknown maker""], ""organisations/institutions"": [""Geodetic Survey of Canada""], ""dates"": [""1920""], ""places"": [""Canadian""], ""descriptions"": [""1920 Triangulation reference mark"", ""unsigned""], ""other"": [""1920""]}"
11,8,10,1,2,0,1,1,1,1,1,1,1,3,2,1,2,"{""object_names"": [""REFERENCE MONUMENT PLATE""], ""makers"": [], ""organisations/institutions"": [], ""dates"": [], ""places"": [], ""descriptions"": [""Where no natural rock is available, reference monuments are built by the Geodetic Survey of Canada to mark the station points."", ""Such monuments are erected in convenient places, preferably near a road, and a plate of the type shown is embedded into them."", ""The plate is rectangular and has two projecting shanks for fixing it into the monument.""], ""other"": [""Inv. 1922-725""]}","{""object_names"": [""triangulation station mark"", ""triangulation mark""], ""makers"": [""Unknown maker""], ""organisations/institutions"": [], ""dates"": [], ""places"": [], ""descriptions"": [""Surveying triangulation mark""], ""other"": [""Bronze"", ""Canadian"", ""1920 Bronze triangulation mark for the Geodetic Survey of Canada, unsigned, Canadian, 1920"", ""triangulation mark 1920 Canada""]}"
12,11,10,1,2,1,1,1,1,1,1,1,1,4,3,2,1,"{""object_names"": [""GEODETIC TRIANGULATION STATION MARK""], ""makers"": [""Survey of Egypt""], ""organisations/institutions"": [""Survey of Egypt""], ""dates"": [""1920""], ""places"": [""Egypt""], ""descriptions"": [""provided with two saw-cuts intersecting at right angles"", ""cemented into a concrete block in the ground"", ""Accurately built into the concrete block is an iron cylinder filled with concrete, having gaps in the bottom so that the mark can be seen"", ""A brass and cast iron tribrach (see Cat. No. 14) is accurately centred over the mark and cemented in the top of the pillar. Upon this tribrach the theodolite rests when sighting to the station, whilst to its centre is screwed a heliograph or lamp when sighting to the station.""], ""other"": [""Inv. 1920-630"", ""This brass bolt forms the station mark""]}","{""object_names"": [""triangulation station mark"", ""triangulation mark""], ""makers"": [""Unknown maker""], ""organisations/institutions"": [""Geodetic Survey of Egypt""], ""dates"": [""1910-1920""], ""places"": [""United Kingdom""], ""descriptions"": [""Bronze station mark for the First Order Triangulation"", ""Surveying triangulation mark""], ""other"": [""Bronze""]}"
13,11,8,1,2,1,0,1,1,1,1,1,1,5,3,1,0,"{""object_names"": [""SELF-CENTRING GEODETIC STATION TRIBRACH""], ""makers"": [""Survey of Egypt""], ""organisations/institutions"": [], ""dates"": [], ""places"": [], ""descriptions"": [""This brass tribrach is built into a masonry pier and accurately centred over the concealed mark at geodetic stations in Egypt."", ""It has three radial V-shaped grooves at angles of 120\u00b0 with one another, and forms a self-centring stand for the three feet of a theodolite or signal lamp."", ""Such a device is especially convenient in countries where the centring of signal lamps over the station point cannot always be entrusted to skilled operators.""], ""other"": [""Inv. 1920-627""]}","{""object_names"": [""station plate"", ""station plates""], ""makers"": [], ""organisations/institutions"": [], ""dates"": [], ""places"": [], ""descriptions"": [""Self-centring station plate for the Survey of Egypt (\""spider\"")"", ""Self-centring station plate for the Survey of Egypt (\""spider\"")""], ""other"": []}"
14,13,8,1,1,1,0,1,0,1,0,1,1,5,4,3,2,"{""object_names"": [], ""makers"": [""Capt. H. G. Lyons, F.R.S.""], ""organisations/institutions"": [""Survey of Egypt""], ""dates"": [""1920-384""], ""places"": [""Qaliub District""], ""descriptions"": [""diagram of traverse lines and marks"", ""second and third order triangulation system shown in red"", ""traverse lines and points shown in black"", ""method of traversing with theodolite and chain is used to control the detail chain survey"", ""traverse system is connected up to the points of the minor triangulation system"", ""traverse lines being chosen to conform so far as possible to the village boundaries"", ""azimuths of these lines are measured with a 5-in. vernier theodolite"", ""lengths measured with 20-m. steel chains"", ""about 15 traverse stations per square kilometre""], ""other"": [""Scale 1: 20,000"", ""Made in the Museum"", ""The Cadastral Survey of Egypt""]}","{""object_names"": [""DIAGRAM OF TRAVERSE LINES AND MARKS""], ""makers"": [], ""organisations/institutions"": [], ""dates"": [], ""places"": [""Qaliub""], ""descriptions"": [""This diagram illustrates a portion of the Cadastral Survey of Egypt, specifically the Qaliub District."", ""It visually represents the survey's methodology, employing traverse lines and triangulation points."", ""The scale of the diagram is 1:20,000."", ""The object is a key component in understanding the historical survey practices employed in Egypt.""], ""other"": [""Science Museum Group"", ""Collection""]}"
15,15,5,2,1,1,0,0,1,1,0,2,0,8,2,1,1,"{""object_names"": [""TRAVERSE MARK"", ""land-anchor type of mark""], ""makers"": [""H. Dray, Esq.""], ""organisations/institutions"": [], ""dates"": [""1921-360""], ""places"": [""Egypt"", ""Nile Valley""], ""descriptions"": [""liability of ordinary metal bolts and bars used as traverse marks in Egypt to removal"", ""successful employed in the soft soil of the Nile Valley and elsewhere"", ""conical iron cap securely attached to the head of a screw pile"", ""screw pile which is buried some 6 ft. below the ground"", ""connected to the cap by a 1/4-in. steel cable"", ""cap has a central socket to receive the ranging rod"", ""rests on a circular concrete block interposed between it and the ground"", ""concrete block, about 1 ft. diameter by 4 in. thickness, has a central hole and is next fitted over the pile-head by means of the keys shown"", ""diagram illustrates the process of fixing the mark in position""], ""other"": [""Inv.""]}","{""object_names"": [""DRAY""], ""makers"": [], ""organisations/institutions"": [""Science Museum Group""], ""dates"": [], ""places"": [], ""descriptions"": [""A land anchor designed by H. Dray for use as a traverse mark in soft soil."", ""Composed of a conical iron cap attached to a buried screw pile, connected by a steel cable.""], ""other"": [""Object ID: 1921-0360""]}"
16,12,4,1,1,1,0,1,0,2,0,3,0,3,2,1,1,"{""object_names"": [""DIAGRAM OF LEVELLING MARKS OF ANCIENT EGYPT""], ""makers"": [""Sir W. Flinders Petrie""], ""organisations/institutions"": [""Museum""], ""dates"": [""Circa 2800 B.C."", ""1891""], ""places"": [""ancient Egypt"", ""Seneferu"", ""Meidum""], ""descriptions"": [""four corner walls of crude brick built round the angles of a rectangular tomb structure known as a \""Mastaba\"""", ""level lines were drawn in red at intervals of one cubit, and numbered to show the distance of each below the \""ground level\"" (nfrw)"", ""sloping black lines show the inclination of the outer face of the masonry \""Mastaba\""""], ""other"": [""Inv. 1920-385""]}","{""object_names"": [""Mastaba levelling diagram""], ""makers"": [], ""organisations/institutions"": [], ""dates"": [], ""places"": [], ""descriptions"": [""The diagram illustrates the method used to level the foundations of a Mastaba tomb in ancient Egypt."", ""The original levelling marks are incised onto plaster on crude brick walls.""], ""other"": [""SMGIC.20715568""]}"
17,8,6,1,1,1,0,0,1,1,0,1,1,3,2,1,1,"{""object_names"": [], ""makers"": [""Made in the Museum""], ""organisations/institutions"": [], ""dates"": [""1920""], ""places"": [""British Isles""], ""descriptions"": [""A number of fundamental bench marks have been fixed in the principal (first order) levelling lines in the British Isles for the purpose of verification from time to time."", ""These bench marks are fixed in rock in order to ensure permanence and immunity from accidental disturbance."", ""One visible mark and two concealed marks, the altitudes of which are accurately known, are provided.""], ""other"": [""Inv. 1920-387""]}","{""object_names"": [], ""makers"": [], ""organisations/institutions"": [""Science Museum Group""], ""dates"": [], ""places"": [""London""], ""descriptions"": [""Object is a diagram related to a fundamental bench mark."", ""Used as a reference point for height measurements in the British Isles.""], ""other"": []}"
18,9,6,1,1,1,0,1,0,1,1,0,0,4,4,1,0,"{""object_names"": [], ""makers"": [""Ordnance Survey""], ""organisations/institutions"": [""Ordnance Survey""], ""dates"": [], ""places"": [], ""descriptions"": [""This bolt forms the upper reference point at a fundamental bench mark on the first order levelling lines of the Ordnance Survey."", ""It is fixed in the top of a granite block forming a pillar 12 in. high, and is the mark for use in all ordinary circumstances, its level being recorded on the topographical maps.""], ""other"": [""Inv. 1914-152""]}","{""object_names"": [], ""makers"": [], ""organisations/institutions"": [], ""dates"": [], ""places"": [], ""descriptions"": [""Bolt forming upper reference point on top of granite pillar at fundamental bench mark"", ""Surveying bench mark; bench mark""], ""other"": []}"
19,9,6,1,3,1,0,1,0,1,1,0,0,4,2,1,0,"{""object_names"": [""BENCH MARK""], ""makers"": [""Ordnance Survey""], ""organisations/institutions"": [""Ordnance Survey""], ""dates"": [], ""places"": [], ""descriptions"": [""First Order"", ""This bolt forms one of the two concealed reference points at a fundamental bench mark of the Ordnance Survey."", ""It is set in rock concrete 3 ft. below ground in a concrete recess 3 ft. square by 1 ft. 9 in. deep"", ""will be used when necessary to determine whether any secular changes of level are in progress""], ""other"": [""Inv. 1914-151""]}","{""object_names"": [""Bolt"", ""Surveying bench mark"", ""bench mark""], ""makers"": [], ""organisations/institutions"": [], ""dates"": [], ""places"": [], ""descriptions"": [""forming one concealed reference point at a fundamental bench mark"", ""forming one concealed reference point at a fundamental bench mark""], ""other"": [""1914""]}"
20,7,13,1,4,1,1,1,1,1,1,0,1,2,3,1,2,"{""object_names"": [""BENCH MARK NAME PLATE""], ""makers"": [""Ordnance Survey""], ""organisations/institutions"": [], ""dates"": [], ""places"": [], ""descriptions"": [""This plate is affixed to the granite pillar of a fundamental bench mark of the Ordnance Survey.""], ""other"": [""Inv. 1914-153""]}","{""object_names"": [""Nameplate for bench mark"", ""surveying instrument component"", ""instrument component""], ""makers"": [""Unknown maker""], ""organisations/institutions"": [""United Kingdom""], ""dates"": [""1914""], ""places"": [], ""descriptions"": [""Bronze name plate for a granite pillar at a fundamental bench mark"", ""bench mark""], ""other"": [""British"", ""unsigned"", ""Bronze""]}"
21,7,7,1,2,1,0,1,0,1,1,0,0,2,3,1,1,"{""object_names"": [""COVER OF REFERENCE BENCH MARKS""], ""makers"": [""Ordnance Survey""], ""organisations/institutions"": [""Ordnance Survey""], ""dates"": [""1914-155""], ""places"": [], ""descriptions"": [""The cover is placed below ground in a fundamental bench mark chamber to protect the reference marks of the Ordnance Survey from interference or damage.""], ""other"": [""Inv. 1914-155""]}","{""object_names"": [""Two covers for the lower reference point of a fundamental bench mark"", ""bench marks""], ""makers"": [], ""organisations/institutions"": [], ""dates"": [""1914""], ""places"": [], ""descriptions"": [""Surveying""], ""other"": [""Surveying bench marks; bench marks""]}"
22,8,6,1,2,1,0,1,0,1,1,0,0,4,3,1,0,"{""object_names"": [""SECONDARY BENCH MARK""], ""makers"": [""Ordnance Survey""], ""organisations/institutions"": [""Ordnance Survey""], ""dates"": [""1912-1921""], ""places"": [], ""descriptions"": [""gun-metal plate set flush with the surface of a wall"", ""identification number cast on it"", ""reference point, to which the published altitude corresponds, is the top of the \""broad arrow\"""", ""foot of the levelling staff is brought to the same altitude as this point with the aid of a detachable bracket and a small spirit-level""], ""other"": [""Inv. 1914-149""]}","{""object_names"": [""Bench mark in wood block""], ""makers"": [], ""organisations/institutions"": [], ""dates"": [""1914""], ""places"": [], ""descriptions"": [""for second order triangulation"", ""Surveying bench marks"", ""bench marks""], ""other"": []}"
23,8,12,1,4,1,1,1,1,1,1,0,1,4,4,1,1,"{""object_names"": [""BENCH MARK BRACKET""], ""makers"": [], ""organisations/institutions"": [], ""dates"": [], ""places"": [], ""descriptions"": [""adjustable bracket is used for supporting the levelling staff at a secondary bench mark on the lines of the first order levelling of the Ordnance Survey"", ""The bracket is hooked on to the bench mark"", ""the surface, upon which the levelling staff is placed, is made level and in agreement with the reference point by means of the adjusting screw and the spirit level""], ""other"": [""Inv. 1914-150""]}","{""object_names"": [""Bracket for use with level on bench mark"", ""stave support"", ""Surveying bracket"", ""bracket - structural element""], ""makers"": [""Unknown maker""], ""organisations/institutions"": [], ""dates"": [], ""places"": [""United Kingdom""], ""descriptions"": [""Adjustable stave support with spirit level for use with secondary bench mark"", ""brass cannister"", ""structural element"", ""bench mark""], ""other"": []}"
