RowIndex,Old_Total,New_Total,Old_ObjectNames,New_ObjectNames,Old_Makers,New_Makers,Old_Organisations/Institutions,New_Organisations/Institutions,Old_Dates,New_Dates,Old_Places,New_Places,Old_Descriptions,New_Descriptions,Old_Other,New_Other,Unique_to_Old,Unique_to_New
71,16,8,1,3,1,1,1,0,3,1,1,1,6,2,3,0,"{""object_names"": [""STUART\u2019S DISTANCE METER""], ""makers"": [""T. H. Court, Esq.""], ""organisations/institutions"": [""Science Museum Group""], ""dates"": [""1895 (assumed date for presentation)"", ""1895 (designer)"", ""1915-399 (inv. number)""], ""places"": [""sea""], ""descriptions"": [""Assuming that the length of a distant ship\u2019s mast is known, its range can be found by this instrument, which was designed in 1895 for use at sea."", ""Two images of the mast are seen in the field of the telescope, one formed by light rays traversing a fixed prism of constant angle, and the other by rays traversing a movable prism of varying angle."", ""These images are made to approach each other until the lower limit of one is level with the upper limit of the other by sliding the movable prism, when the position of an index attached to this permits the range to be read."", ""The movable prism consists of a thin piece of glass, ground concave on both faces, and is attached to a slide worked by a tangent screw."", ""It thus forms a prism of varying angle in front of one half of the telescope, the other half being occupied by the fixed constant angle prism."", ""Ranges up to 3 miles can be read to the nearest tenth of a mile.""], ""other"": [""British Patent Specification, No. 23834, 1895""]}","{""object_names"": [""Marine distance meter"", ""distance meter""], ""makers"": [], ""organisations/institutions"": [], ""dates"": [], ""places"": [""United Kingdom""], ""descriptions"": [""Stuart (designer)""], ""other"": [""Surveying distance meter""]}"
72,11,7,1,1,0,0,0,1,1,0,0,0,8,3,1,2,"{""object_names"": [], ""makers"": [], ""organisations/institutions"": [], ""dates"": [""1920-66""], ""places"": [], ""descriptions"": [""pocket rangefinder suitable for military reconnaissance"", ""To determine ranges up to 3,000 m."", ""two observations are made with it, one from each end of a 30 m. base, which is set off approximately at right angles to the direction of the object."", ""consists of a short metal tube having a pin-hole sight at one end and a rectangular window in one side."", ""Opposite this window within the tube are two small plane mirrors inclined at an angle of 45\u00b0 to each other."", ""Both mirrors can be rotated slightly."", ""The observer views the object A whose range is required directly through the pin-hole sight, and rotates one mirror until he sees, after double reflection, the image of an object B whose direction is nearly perpendicular to A's."", ""He measures off the base in the direction of B, and again views A directly. By rotating the second mirror he once more gets a doubly reflected image of B. This latter rotation is effected by turning a milled drum in the eye end of the instrument, and the position of this drum when B is again sighted is a measure of the range of A. The drum is calibrated to give this range immediately."", ""A thin cord of the base length is supplied with the instrument.""], ""other"": [""See \u201cFieldwork and Instruments,\u201d 1900, pp. 236-239, by A. T. Walmisley.""]}","{""object_names"": [], ""makers"": [], ""organisations/institutions"": [""Science Museum Group""], ""dates"": [], ""places"": [], ""descriptions"": [""A device for measuring distances, particularly to distant objects, using a fixed base length and optical principles."", ""Based on triangulation principles, it allows for the determination of distances up to 3,000 meters by using a 30-meter base."", ""Features a precisely engineered optical system with mirrors and sights for accurate readings.""], ""other"": [""Accession number: 1920-66""]}"
73,12,5,1,2,1,0,0,1,1,1,0,0,8,1,1,0,"{""object_names"": [], ""makers"": [""T. H. Court, Esq.""], ""organisations/institutions"": [], ""dates"": [], ""places"": [], ""descriptions"": [""This instrument is used to measure ranges in the ordinary manner, by solving a very acute right-angled triangle."", ""The angle subtended at the distant point is constant, whilst the base is variable, and is measured by pacing."", ""Three reflecting right-angled prisms are mounted by hinged joints near the objective of a small telescope, so that any one of the three can be set to reflect rays axially along the telescope from directions at 90\u00b0, 88\u00b0 51\u2032 15\u2033 and 74\u00b0 53\u2032 15\u2033 respectively."", ""The first prism is used to set off the base at right angles to the direction of the distant object."", ""The observer paces in the line of the base until, using one of the other two prisms, he again sees the object by reflection."", ""For both observations the telescope is directed to view another distant point at right angles to the target, i.e., in the direction of the base."", ""The number of paces taken between the two observations, multiplied by a constant depending upon the length of pace and the reflecting angle of the second prism used, gives the required range."", ""The constant is determined experimentally.""], ""other"": [""Inv. 1911-151""]}","{""object_names"": [""Surveying telemeter"", ""telemeter""], ""makers"": [], ""organisations/institutions"": [""Science Museum Group""], ""dates"": [], ""places"": [], ""descriptions"": [""Surveying telemeter; telemeter""], ""other"": []}"
74,18,7,2,3,1,1,2,1,2,1,2,0,10,1,1,0,"{""object_names"": [""rangefinder"", ""pocket telemeter""], ""makers"": [""Tavernier-Gravet""], ""organisations/institutions"": [""French army"", ""Science Museum Group""], ""dates"": [""about 1865"", ""1865""], ""places"": [""Paris"", ""France""], ""descriptions"": [""This rangefinder was designed by Capt. Gautier, a French artillery officer, about 1865, and has been extensively used in the French army."", ""Its main feature is a thin prism mounted in a ring at the object end of the sighting tube."", ""By rotating the ring the deviation of rays in the plane of the distant object and the horizontal through the instrument can be varied continuously, and the ring calibrated correspondingly."", ""The sighting tube is about 5 in. long by 1\u00b75 in. diam. and has a protecting tube which can be fitted underneath to serve as a hand-grip when observations are being made."", ""The sighting tube, in addition to the movable ring containing the prism, has a pair of plane mirrors having their faces inclined to each other at an angle of about 45\u00b0, and so inclined to the optical axis that rays incident through a window in the side of the tube in a direction nearly perpendicular to the axis, are doubly reflected at the mirrors into the line of the axis, and pass through a small telescope at the eye end of the tube."", ""In the instrument shown, two such telescopes of different powers are fixed side by side."", ""One of the mirrors can be slightly rotated so as to vary the angle of deviation of the reflected rays."", ""In using the instrument, the observer sets the range scale on the movable ring at \u201cinfinity\u201d and the index of the movable mirror at the centre."", ""He views the distant object by double reflection at the mirrors and looks directly through the tube and prism for a convenient aiming mark."", ""If such a mark is not quite co-incident with the image of the distant object, he rotates the mirror until coincidence occurs."", ""Then the object and the aiming mark are in directions nearly perpendicular to each other."", ""Next he paces out a convenient distance in the direction of the aiming mark and takes a second observation similar to the first, but this time effects the coincidence by means of the movable prism."", ""He reads off the scale calibrated on that ring when coincidence is effected and multiplies the distance of his base."", ""The result is the range of the distant object."", ""The movable ring is really calibrated to record the reciprocal of the angle of deviation caused by the prism, which is the same as the reciprocal of the angle subtended. by the base at the object."", ""As this base has been made nearly perpendicular to the direction of the object, the product of its length and the reciprocal of the angle gives the range."", ""Thus any convenient base length can be used subject to the condition that it subtends an angle of not more than 3\u00b0 at the distant object."", ""(See \u201c Notice sur le T\u00e9l\u00e9m\u00e8tre de Poche,\u201d by A. Gautier, Paris.)""], ""other"": [""Inv. 1910-126""]}","{""object_names"": [""Gautier's pocket telemeter""], ""makers"": [], ""organisations/institutions"": [], ""dates"": [], ""places"": [], ""descriptions"": [""Surveying telemeter; telemeter""], ""other"": []}"
75,14,7,2,1,1,0,1,1,1,1,1,0,6,1,2,3,"{""object_names"": [""MEKOMETER"", ""GENERAL SERVICE PATTERN""], ""makers"": [""T. Cooke and Sons, Ltd.""], ""organisations/institutions"": [], ""dates"": [], ""places"": [""York""], ""descriptions"": [""standard rangefinding set"", ""used by infantry units"", ""comprises two optical sighting instruments, known as the \u201cRight Angle\u201d and \u201cReading\u201d instruments"", ""two reels of cord, each 25 yd. long, for setting off the base"", ""The observer at one end of the base uses the \u201cRight Angle\u201d instrument to make the base line perpendicular to the line joining his position to the distant object, after which the other observer uses his \u201cReading\u201d instrument to measure the angle between the base line and the direction of the object from his position."", ""The Right Angle instrument has two fixed vertical mirrors inclined to each other at an angle of 45\u00b0. The observer using this sees the target directly and the vane on the Reading instrument after double reflection at the two mirrors. He adjusts his position, keeping the base line fully extended, until the two images coincide. The Reading instrument differs only in that one of its mirrors can be rotated, and the rotation recorded upon a graduated drum, so that the images of the target (viewed directly) and the vane of the Right Angle instrument (viewed by double reflection on the two mirrors) can be made to coincide. The graduated drum is calibrated to record the range directly.""], ""other"": [""Inv. 1914-293"", ""(\""Handbook of the Mekometer.\"")""]}","{""object_names"": [""Mekometer""], ""makers"": [], ""organisations/institutions"": [""Science Museum Group""], ""dates"": [""1914""], ""places"": [], ""descriptions"": [""rangefinder""], ""other"": [""smg-804227"", ""Object ID"", ""Object Type""]}"
76,17,11,1,1,1,1,3,1,4,2,1,3,5,2,2,1,"{""object_names"": [], ""makers"": [], ""organisations/institutions"": [""Admiralty"", ""Barr and Stroud""], ""dates"": [""1860"", ""1885 to 1904""], ""places"": [""East Coast of England""], ""descriptions"": [""This type of rangefinder was designed by P. Adie in 1860, and was extensively used by the Admiralty until superseded by the Barr and Stroud pattern."", ""The rangefinder consists of two systems of lenses and right-angled reflecting prisms mounted in a 3-ft. metal tube of square section."", ""Each system forms a \u201cbroken\u201d telescope, the objectives being at each end of the tube, along which the rays, originally perpendicular to it, are deflected by right-angled prisms to the centre, where they are again reflected at right angles into the common central eye-piece."", ""In this manner two images of a distant object whose direction is nearly perpendicular to the axis of the tube are obtained, one through each system. These images will be separated laterally by an interval which diminishes continuously as the range increases, but does not become zero until the object is at an infinite distance."", ""If the objective lens and two prisms of one system are separately mounted and can be rotated with respect to the other system, the two images may be made to coincide by such a rotation, and the angle of rotation necessary will vary inversely as the range of the object. This angle can be obtained by calculation, or a table of corresponding values. In the instrument exhibited such an arrangement is effected by mounting one object lens and its pair of reflecting prisms in a separate tube within the main tube containing the other set, and pivoted to this so that the rotation can be effected by a screw threaded in the outer tube with its end pressing against the inner. The angle of rotation is measured by a vernier on one tube and a scale nearest second of arc, and the range read off on a table fixed to the outer leather protecting cover.""], ""other"": [""Inv. 1909-139"", ""(See British Patent, 1860, No. 357; and 1863, No. 608.)""]}","{""object_names"": [], ""makers"": [""Adie & Son""], ""organisations/institutions"": [], ""dates"": [""c.1885""], ""places"": [""Edinburgh, Scotland, United Kingdom""], ""descriptions"": [""Surveying telemeter; telemeter"", ""3 ft base line""], ""other"": []}"
77,7,0,1,0,1,0,1,0,1,0,0,0,1,0,2,0,"{""object_names"": [""BARR AND STROUD INFANTRY RANGEFINDER. (Early Type.)""], ""makers"": [""Barr & Stroud, Ltd.""], ""organisations/institutions"": [""Barr & Stroud""], ""dates"": [""1889""], ""places"": [], ""descriptions"": [""This instrument was made in 1889, and is one of the first rangefinders constructed by Messrs. Barr & Stroud for use by infantry. It is a single-observation, coincidence instrument, with a fixed base of 80 cm., and measures ranges between 200 and 2,000 yd. with a percentage error directly proportional to the distance. The instrument is optically equivalent to a pair of telescopes having a common central eye-piece and their axes in opposite directions along the base-line, at the ends of which are the two objective lenses. Two pencils of rays diverging from the distant object to each end of the instrument are reflected at right angles by mirrors so as to traverse the objectives and form two images at the centre, where they are again reflected at right angles by a pair of mirrors, one of which is parallel to each end mirror. The two images are thus viewed in the focal plane of the right eyepiece of the instrument, and are separated laterally by a distance inversely proportional to the required range. Between the right objective lens and the central mirrors there is a small angled deflecting prism, which can move along the axis, and in so doing increases or decreases the amount of separation of the two images. In one position of the prism, corresponding to the distance of the object, the two images coincide. A scale attached to the prism moves with it and is graduated so to give the range directly. This scale and its fixed index-line are viewed by the observer\u2019s left eye in a separate eyepiece, which also serves in conjunction with a field lens as a small telescope of large field for picking up the target.""], ""other"": [""Inv. 1914-180"", ""Lent by Messrs. Barr & Stroud, Ltd.""]}","{""object_names"": [], ""makers"": [], ""organisations/institutions"": [], ""dates"": [], ""places"": [], ""descriptions"": [], ""other"": []}"
78,10,15,1,3,1,1,2,1,2,2,0,3,3,3,1,2,"{""object_names"": [""BARR AND STROUD RANGEFINDER ON NAVAL MOUNTING""], ""makers"": [""Barr & Stroud, Ltd.""], ""organisations/institutions"": [""Messrs."", ""R.N.""], ""dates"": [], ""places"": [], ""descriptions"": [""used by Dr. Bruce in the Weddell Sea Antarctic expedition on the \u201cScotia\u201d"", ""afterwards by Capt. R. F. Scott"", ""on the \u201cTerra Nova\u201d in the British Antarctic expedition""], ""other"": [""Inv. 1914-179""]}","{""object_names"": [""Optical range-finder"", ""Barr and Stroud range-finder"", ""Surveying parallax range-finder; parallax range-finder""], ""makers"": [""Barr and Stroud""], ""organisations/institutions"": [""United Kingdom""], ""dates"": [], ""places"": [""British"", ""Glasgow, Glasgow, Scotland"", ""1900""], ""descriptions"": [""4ft 6ins base"", ""used aboard ship on Antarctic Expeditions""], ""other"": [""Optical"", ""Surveying""]}"
79,11,7,1,1,1,1,0,1,2,1,0,0,6,1,1,2,"{""object_names"": [], ""makers"": [], ""organisations/institutions"": [], ""dates"": [""1901 (Designed)"", ""1901""], ""places"": [], ""descriptions"": [""Designed this type of rangefinder in 1901, for use by infantry in measuring ranges up to 3,000 yd."", ""The power of the eyes to \u201cconverge\u201d to a varying degree upon objects at different distances, and to measure distances by the muscular effort so required, is limited normally to small distances of a few yards."", ""Consequently, in this, as in all stereoscopic rangefinders, optical means are employed to bring the image of the object ranged upon within the limit of normal eye convergence."", ""The use of an optical base, whose function is to increase the inter-ocular distance from 2\u00b75 in. to 72 in., and a pair of binoculars of magnification 8 diam. enables the radius of stereoscopic vision to be increased 240 times."", ""balloon."", ""The distance between the two balloon images is varied by a micrometer screw. If the observer combines these balloon images stereoscopically into one, and does the same with the images of the distant object, he can judge the apparent distances of the two images, and turn the screw until these distances coincide. The rotation of the screw thus serves as a measure of the required range, and this can be read off directly on a circular scale, attached to the screw and suitably graduated.""], ""other"": [""Inv. 1920-442.""]}","{""object_names"": [], ""makers"": [], ""organisations/institutions"": [""Science Museum Group""], ""dates"": [""20th century""], ""places"": [], ""descriptions"": [""A portable stereoscopic rangefinder designed by Professor G. Forbes.""], ""other"": [""FORBES\u2019 STEREOSCOPIC RANGEFINDER."", ""Lent by Prof. G. Forbes, F.R.S.""]}"
80,7,14,1,2,1,1,0,1,1,1,0,4,3,3,1,2,"{""object_names"": [""TACHEOMETER""], ""makers"": [""Troughton & Simms""], ""organisations/institutions"": [], ""dates"": [""1890-55""], ""places"": [], ""descriptions"": [""A Porro \""anallatic\"" lens is inserted between the objective and eye lenses of this instrument and its horizontal and vertical circles are divided centesimally."", ""It is used in conjunction with a graduated tacheometric staff, upon which the interval subtended between the fixed cross wire varies directly as the distance of the staff from the transverse axis of the instrument, which is itself vertically above the observing station point.""], ""other"": [""Inv.""]}","{""object_names"": [""Tacheometer with slide rule and components"", ""Surveying tacheometer""], ""makers"": [], ""organisations/institutions"": [""Science Museum Group""], ""dates"": [""1885-1895""], ""places"": [""London"", ""Fleet Street, City of London, London, England, United Kingdom""], ""descriptions"": [""4-inch"", ""Sighting tube has been sectioned.""], ""other"": [""staff"", ""slide rule and tables""]}"
81,14,9,2,2,1,1,0,0,1,1,1,3,7,2,2,0,"{""object_names"": [""tacheometer""], ""makers"": [""St\u00e4rke & Kammerer""], ""organisations/institutions"": [], ""dates"": [""about 1868""], ""places"": [""Vienna""], ""descriptions"": [""Made by St\u00e4rke & Kammerer, Vienna."", ""To convert a theodolite into a tacheometer for measuring distances, many devices have been proposed which permit the telescope, when directed upon a graduated staff, to be displaced through a constant small angle, whose limits are determined by two mechanical stops."", ""The distance so measured on the staff will vary directly as the horizontal distance of the staff from the observing station and inversely as the square of the cosine of the altitude angle."", ""As the latter is known, the former can be calculated by using special tables."", ""In the tacheometer invented about 1868 by A. Gentilli, the Austrian engineer, a rigid vertical arm can be clamped to the transverse axis of the telescope in any position."", ""The lower end of this arm can only move a short distance, being limited by two mechanical stops."", ""Consequently the vertical angle through which the telescope can move when clamped to the arm is likewise limited."", ""The instrument in other respects is like an ordinary theodolite of the type made by St\u00e4rke about this period."", ""It has a 5-in. horizontal circle and a 3.5-in. vertical quadrant, both reading by vernier and reading microscope to 30'' and having the usual clamps and tangent screws."", ""The telescope has an objective lens of 12 in. focal length and 1.5 in. aperture."", ""The instrument has four levelling screws, two small spirit levels mutually perpendicular on the horizontal circle, and a more sensitive one on the telescope.""], ""other"": [""Inv. 1876-1205"", ""A. Gentilli""]}","{""object_names"": [""Gentilli type tacheometer""], ""makers"": [""Starke & Kammerer""], ""organisations/institutions"": [], ""dates"": [""1868-1876""], ""places"": [""Austria"", ""Vienna"", ""Wien""], ""descriptions"": [""Surveying tacheometer""], ""other"": []}"
82,14,7,1,1,1,1,1,1,1,1,0,2,10,1,1,0,"{""object_names"": [], ""makers"": [], ""organisations/institutions"": [], ""dates"": [], ""places"": [], ""descriptions"": [""An early example of a theodolite modified to enable distances to be measured with it simultaneously with azimuth and altitude angles is here represented in the \u201cOmnimeter,\u201d invented by C. A. C. Eckhold in 1868. This instrument is used in conjunction with a special tacheometric staff having a fixed interval, usually 10 ft., marked upon it. A microscope, rigidly attached with its axis perpendicular to that of the observing telescope, rotating with this telescope about a common transverse axis, measures upon a scale fixed horizontally upon the upper plate of the theodolite the distance traversed when the observing telescope is rotated from the upper mark to the lower mark of the staff. As this staff is always set up vertically, its horizontal distance from the centre of the instrument is inversely proportional to the distance traversed on the scale. The microscope scale is mounted parallel to the telescope at a distance of exactly 6 in. below the transverse axis. It is 4 in. long and is graduated to read 0\u00b702 in. directly, whilst it can be moved on the plate, parallel to its own length, through a small interval by means of a micrometer screw with a graduated drum, which measures 0\u00b7002 of each division of the scale. In this manner the ultimate graduation of the scale corresponds to 4 \u00d7 10\u207b\u2075 in. so that, if n such divisions are traversed when the theodolite rotates from the upper to the lower mark of the staff, the distance of this staff from the instrument will be 15 \u00d7 10\u00b3 \u00f7 n ft. In other respects the instrument is similar to an ordinary transit repeating theodolite. It has 5-in. vertical and horizontal circles reading by vernier to single minutes. The focal length of the telescope is 11 in., and its aperture 1\u00b725 in. It is fitted with a Ramsden eyepiece. Slow-motion tangent screws are provided for each circle, and the usual spirit-levels on the plate and telescope. A diagonal eyepiece is fitted to the microscope for convenience in taking steep sights."", ""early example of a theodolite modified to enable distances to be measured with it simultaneously with azimuth and altitude angles"", ""used in conjunction with a special tacheometric staff having a fixed interval, usually 10 ft., marked upon it"", ""microscope, rigidly attached with its axis perpendicular to that of the observing telescope, rotating with this telescope about a common transverse axis, measures upon a scale fixed horizontally upon the upper plate of theodolite the distance traversed when the observing telescope is rotated from the upper mark to the lower mark of the staff"", ""staff is always set up vertically"", ""horizontal distance from the centre of the instrument is inversely proportional to the distance traversed on the scale"", ""microscope scale is mounted parallel to the telescope at a distance of exactly 6 in. below the transverse axis"", ""scale is 4 in. long and is graduated to read 0\u00b702 in. directly"", ""micrometer screw with a graduated drum, which measures 0\u00b7002 of each division of the scale"", ""ultimate graduation of the scale corresponds to 4 \u00d7 10\u207b\u2075 in."", ""formula for distance calculation: 15 \u00d7 10\u00b3 \u00f7 n ft."", ""similar to an ordinary transit repeating theodolite"", ""has 5-in. vertical and horizontal circles reading by vernier to single minutes"", ""telescope has a focal length of 11 in., and its aperture 1\u00b725 in."", ""fitted with a Ramsden eyepiece"", ""slow-motion tangent screws are provided for each circle"", ""usual spirit-levels on the plate and telescope"", ""diagonal eyepiece is fitted to the microscope for convenience in taking steep sights""], ""other"": [""Inv. 1900-90""]}","{""object_names"": [], ""makers"": [], ""organisations/institutions"": [], ""dates"": [], ""places"": [""London, England"", ""United Kingdom""], ""descriptions"": [""Surveying tacheometer""], ""other"": []}"
