RowIndex,Old_Total,New_Total,Old_ObjectNames,New_ObjectNames,Old_Makers,New_Makers,Old_Organisations/Institutions,New_Organisations/Institutions,Old_Dates,New_Dates,Old_Places,New_Places,Old_Descriptions,New_Descriptions,Old_Other,New_Other,Unique_to_Old,Unique_to_New
123,12,11,2,3,1,1,1,1,1,1,0,3,5,2,2,0,"{""object_names"": [""GRADUATED RULES FOR LEVELLING RODS"", ""portions of those used in the ordinary Sopwith type of staff""], ""makers"": [], ""organisations/institutions"": [], ""dates"": [], ""places"": [], ""descriptions"": [""illustrates the method of engraving wooden and invar rules for their levelling rods now adopted by Messrs. Watts."", ""The portions to be painted black on the white surface of the rule are first gouged out to a sufficient depth and the black filled in nearly flush with the white surface; the black bands are thus rendered very durable."", ""one showing the graduations cut and the strips gouged out, the other the finished rule, with the strips filled in and figured."", ""made of invar, for use in a precise levelling rod, and the bands of black at 0.02-ft. intervals are not so wide as in the other type of rod, where they are exactly 0.01 ft. wide."", ""In the latter case the lower edges of the bands define the odd hundredths of a foot and the upper edges the even hundredths; in the invar rod, only the upper edges are used, the cross wire of the telescope being made to coincide with this edge in taking a reading.""], ""other"": [""E. R. Watts & Son, Ltd."", ""Inv. 1922-446""]}","{""object_names"": [""levelling staves"", ""graduated scales for levelling staves"", ""Surveying levelling staff; levelling staff""], ""makers"": [], ""organisations/institutions"": [], ""dates"": [], ""places"": [""London"", ""England"", ""United Kingdom""], ""descriptions"": [""Three specimens"", ""c 1920""], ""other"": []}"
124,13,11,1,2,1,1,1,1,1,1,0,3,8,3,1,0,"{""object_names"": [""PORTION OF INVAR PRECISE LEVELLING ROD""], ""makers"": [""E. R. Watts & Son, Ltd.""], ""organisations/institutions"": [""E. R. Watts & Son, Ltd.""], ""dates"": [""1922""], ""places"": [], ""descriptions"": [""metal scale for levelling staves have until recently been counterbalanced by the tendency of such scales to expand when heated, and the difficulty of ascertaining their temperature in order to apply the necessary correction"", ""invention of \u201cinvar\u201d\u2014a nickel-steel alloy of negligible temperature coefficient\u2014has now led to its employment in levelling rods used in precise surveys"", ""The invar rule is painted white and engraved with black bands at intervals of 0.02 ft., every fifth band extending over the complete width (about 2 cm.) of the rule, and the others over half its width"", ""The rule is then screwed into a central recess in the face of the wooden rod, which has an I section for strength and lightness, and is shod with a metal shoe terminating in a flat base plate; the bottom of the invar rule is flush with this plate"", ""The face of the wooden rod is painted white and numbered opposite the marks corresponding to intervals of 0.1 ft. on the invar rule"", ""The numbers are in black, and are inverted so as to be seen erect in the telescope of the level; a V is used instead of 5 and an N instead of 9"", ""At the divisions of the rule corresponding to an integral number of feet from the base plate, large red numbers are painted on the wood, and are twice repeated in smaller sized numbers on the opposite side of the face so that the observer has always one of the red numbers in the telescope field"", ""In estimating the position of the cross wire with respect to the graduated scale of the rod, the nearest 0.02-ft. mark is taken and the remaining interval found either by elevating or depressing the telescope by a fine-motion screw, or by moving an optical device which causes the image of the rod to be raised or lowered in the telescope field. The position of the cross wire is thus readily found to 0.001 ft.""], ""other"": [""Inv. 1922-467""]}","{""object_names"": [""Invar strip"", ""Surveying instrument component; levelling staff; instrument component; levelling staff""], ""makers"": [""E. R. Watts and Son""], ""organisations/institutions"": [""E. R. Watts and Son""], ""dates"": [""1915-1922""], ""places"": [""London, England"", ""United Kingdom"", ""London, England, United Kingdom""], ""descriptions"": [""part of precise levelling staff"", ""British""], ""other"": []}"
125,15,8,1,2,1,1,0,0,0,1,0,1,11,2,2,1,"{""object_names"": [""MOUNTAIN BAROMETER""], ""makers"": [""West""], ""organisations/institutions"": [], ""dates"": [], ""places"": [], ""descriptions"": [""closed cistern mercury barometer of the type common in the late 18th and early 19th centuries"", ""specially adapted for portability and thus capable of employment in measuring altitudes"", ""When it is being transported, the mercury can be forced up so as to fill the tube completely by turning an adjusting screw, which depresses the flexible leather base of the cistern"", ""The aperture in the wooden case, used for reading the height of the mercury and the temperature, can also be closed by a rotating brass sheath"", ""graduated in inches, and reads by a vernier index, operated by a rack and pinion mechanism, to 0.002 in"", ""A thermometer, provided with Centigrade and Fahrenheit scales, is placed near the top of the instrument"", ""A suspension ring is fixed at the top, and is covered by a ferrule when the instrument is being carried"", ""A screw cap at the bottom likewise serves to enclose the adjusting screw which operates on the cistern"", ""The wooden case which encloses the lower part of the tube is graduated in inches, so that the instrument can serve as a rough measuring rod"", ""mercury barometer"", ""Surveying mercury barometer""], ""other"": [""G. J. Symons, F.R.S."", ""Inv. 1893-134""]}","{""object_names"": [""Mountain barometer""], ""makers"": [""Unknown maker""], ""organisations/institutions"": [], ""dates"": [""1845-1855""], ""places"": [""Unknown place""], ""descriptions"": [""mercury barometer""], ""other"": [""unsigned""]}"
126,18,10,1,2,1,1,1,1,0,1,0,4,13,1,2,0,"{""object_names"": [""MOUNTAIN BAROMETER""], ""makers"": [""Dollond""], ""organisations/institutions"": [""F.R.S""], ""dates"": [], ""places"": [], ""descriptions"": [""This resembles the adjacent instrument, made by West, in its general character- istics of compactness and portability, but differs in the arrangement of the cistern."", ""This is of the usual flexible base type, but has a supplementary syphon tube, connected to the cistern by a narrow neck, which can be closed by means of a cock."", ""When the instrument is being used, the cock is opened, and the mercury allowed to attain a fixed height in the syphon tube."", ""This is the zero of the barometer tube scale."", ""For transporting the barometer, the mercury is withdrawn from the syphon tube and the cock closed, after which the flexible base of the cistern is de- pressed by means of the adjusting screw until the mercury completely fills the barometer tube."", ""The barometer tube is graduated in inches, and read to 0\u00b7002 in. by a vernier attached to the movable index."", ""A thermometer with Centigrade and Fahrenheit scales is fixed near the top."", ""The window for reading this and the barometer can be closed by means of a rotating brass shutter, and a similar shutter at the bottom of the instrument serves to protect the cistern and syphon tube when required."", ""compactness"", ""portability"", ""flexible base type"", ""supplementary syphon tube"", ""vernier""], ""other"": [""G. J. Symons"", ""Inv. 1893-133""]}","{""object_names"": [""mountain barometer"", ""Surveying barometer; barometer""], ""makers"": [""Dollond family""], ""organisations/institutions"": [""Dollond family""], ""dates"": [""1801-1850""], ""places"": [""London"", ""Greater London"", ""England"", ""United Kingdom""], ""descriptions"": [""London""], ""other"": []}"
127,15,5,2,1,1,1,0,1,2,1,0,0,9,1,1,0,"{""object_names"": [""MOUNTAIN BAROMETER"", ""Gay-Lussac syphon-tube mercury barometer""], ""makers"": [], ""organisations/institutions"": [], ""dates"": [""about 1840""], ""places"": [], ""descriptions"": [""constructed probably about 1840"", ""in which both the long and short tubes are closed completely at the end, but a small aperture in the side of the short tube permits the air to enter whilst preventing the mercury escaping, was essentially a portable instrument, and was, therefore, often used for measuring altitudes prior to the invention of the aneroid"", ""The instrument exhibited is of this type"", ""The barometer tube is enclosed in a brass case, at the ends of which are cork cushions"", ""Scales graduated directly to 0\u00b702 in. and read by movable verniers to 0\u00b7001 in. are engraved upon the case opposite the ends of the mercury"", ""Each vernier has an index which can be set level with the top of the mercury column"", ""The difference between the two readings then gives the height of the barometer"", ""A thermometer, with Centigrade and Fahrenheit graduations, is fixed near the centre of the tube"", ""This instrument is attached by brackets to a wooden stand, and can be set accurately vertical by means of three screws threaded in the lower bracket with their ends pressing against the case of the barometer"", ""For mountain barometers a tripod stand was usually provided""], ""other"": [""Inv. 1907-65""]}","{""object_names"": [""Barometer""], ""makers"": [], ""organisations/institutions"": [""Science Museum Group""], ""dates"": [""early 19th century"", ""1801-1850""], ""places"": [], ""descriptions"": [""Surveying barometer""], ""other"": []}"
128,11,10,2,3,1,1,0,1,1,1,0,3,6,1,1,0,"{""object_names"": [""aneroid barometer"", ""mercury barometer""], ""makers"": [], ""organisations/institutions"": [], ""dates"": [""about 1890""], ""places"": [], ""descriptions"": [""for the use of surveyors in measuring altitudes up to 4,000 ft"", ""The zero mark of the altitude scale corresponds to a height of 32 in."", ""The altitude scale has a diam. of 3\u00b75 in., and is graduated every 10 ft., single feet being estimated"", ""The movable glass cover carries an index mark, which is set to the last height read, and a small lens for facilitating reading"", ""The altitude scale is slightly raised on a step so that its inside graduated edge is flush with an aluminium plate fixed to the tip of the hand and provided with a mark"", ""By this arrangement errors due to parallax are avoided"", ""The instrument is compensated for temperature variations""], ""other"": [""Inv. 1893-119""]}","{""object_names"": [""Aneroid barometer with altitude scale"", ""Surveying aneroid barometer""], ""makers"": [], ""organisations/institutions"": [""Science Museum Group""], ""dates"": [""1885-1993""], ""places"": [""Holborn, London, England"", ""Holborn, London, England, United Kingdom"", ""United Kingdom""], ""descriptions"": [""and case""], ""other"": []}"
129,14,7,1,2,1,2,1,0,1,1,0,0,8,2,2,0,"{""object_names"": [""WATKIN ANEROID BAROMETER""], ""makers"": [""J. Hicks""], ""organisations/institutions"": [""Science Museum Group""], ""dates"": [""1907""], ""places"": [], ""descriptions"": [""aneroid barometers many attempts have been made to provide scales suitable for a very extended range of altitudes"", ""three concentric circular scale arrangement devised by Major H. S. S. Watkin"", ""altitudes from zero to 10,860 ft. can be measured"", ""zero graduation corresponds to a height of 31 in. in the mercury barometer"", ""Altitudes from zero to 3,440 ft. are marked at 20 ft. intervals on the outermost scale, which has a diameter of 3\u00b76 in."", ""middle scale, of diam. 2\u00b79 in., records altitudes from 3,440 ft. to 6,860 ft."", ""innermost scale, of diam. 2\u00b72 in., completes the range to 10,860 ft., every 20 ft. being marked on each scale"", ""corresponding mercury barometer scales are marked at 0\u00b702 in. intervals from 31 in. to 20 in."", ""indicator exhibits the number 1, 2 or 3, corresponding to the outer, middle and inner scales respectively"", ""number indicated is marked upon a plate worked by the mechanism, and is automatically altered when the barometer hand reaches the end of the scale concerned"", ""breaks in the circles are indicated by black bars"", ""revolving glass cover carries an index hand, which can be set to the last reading taken"", ""compensated for temperature variations""], ""other"": [""British Patent Specification, No. 14730, of 1886"", ""Inv. 1907-67""]}","{""object_names"": [""Watkin aneroid barometer"", ""Surveying aneroid barometer""], ""makers"": [""James Joseph Hicks""], ""organisations/institutions"": [], ""dates"": [""1886""], ""places"": [], ""descriptions"": [""patented 1886""], ""other"": []}"
130,14,7,1,1,1,1,2,0,3,1,0,1,5,2,2,1,"{""object_names"": [""EARLY THERMOMETRICAL BAROMETER""], ""makers"": [""Francis J. Hyde Wollaston""], ""organisations/institutions"": [""Royal Society"", ""Phil. Trans.""], ""dates"": [""1817"", ""before 1821"", ""1820""], ""places"": [], ""descriptions"": [""a new \""thermometrical barometer\"" of the type here exhibited"", ""essentially a very sensitive \""boiling-point\"" thermometer"", ""whereby the temperature at which water boils may be found to within a thousandth of a degree Fahrenheit, and the altitude of the place determined accordingly"", ""The bulb of the thermometer is spherical and has a diameter of about an inch. The tube has a length of 30 in. and a very fine bore, so that one degree Fahrenheit corresponds to a movement of the mercury in the tube of 4 in. This is measured by means of a brass scale fixed on the face of the rod which supports the tube. The scale is graduated to read 0\u00b702\u00b0 F. directly, and 0\u00b7002\u00b0 F. by means of a movable vernier."", ""The rod carries a double walled tin cylinder surrounding the bulb of the thermometer. The cylinder can be detached and partly filled with water, which is then boiled by means of a spirit lamp so that the steam surrounds the bulb of the thermometer. Along the side of the rod is attached a strip of paper on which is marked a scale of corrections to be applied to the temperature scale, owing probably to inequalities in the diameter of the bore of the tube.""], ""other"": [""Rev. T. P. W. Worswick"", ""Inv. 1914-735""]}","{""object_names"": [""hypsometer""], ""makers"": [""F.J.H. Wollaston""], ""organisations/institutions"": [], ""dates"": [""c. 1820""], ""places"": [""Mountain""], ""descriptions"": [""Surveying hypsometer"", ""hypsometer""], ""other"": [""\""Mountain barometer\""""]}"
131,18,7,1,1,1,1,0,1,1,1,1,2,13,1,1,0,"{""object_names"": [], ""makers"": [], ""organisations/institutions"": [], ""dates"": [], ""places"": [""mountainous districts""], ""descriptions"": [""Although not so accurate as a standard barometer, a hypsometer for determining altitudes by means of the boiling point of water is more convenient for rapid surveys in mountainous districts."", ""The example shown is of the \u201cpocket\u201d type much used by Alpine travellers."", ""Its thermometer is graduated from 180\u00b0 to 215\u00b0 F. by 0\u00b702\u00b0."", ""The apparatus consists of a brass water container and steam jacket, in which the thermometer is suspended and which is fixed above a small spirit lamp for boiling the water."", ""A brass case surrounds the lamp, which is further screened from wind by means of a black japanned tin box, provided with air holes covered by wire gauze."", ""The thermometer is suspended with its bulb inside an inner tube connected to the boiler."", ""An outer telescopic tube surrounds this and serves to support the thermometer in addition to forming a steam jacket enclosing the mercury as much as possible."", ""The steam escapes by a hole in the top of this outer tube."", ""In improved hypsometers it is made to retrace its path downwards and escape at the bottom of the steam jacket."", ""With this apparatus altitudes are determined by means of specially prepared tables provided with the instrument, giving the heights above sea level corresponding to a particular temperature at which water boils, and also corrections to be made for latitude, mean temperature of the air, and decrease of gravity with increase of elevation."", ""pocket type"", ""Alpine travellers"", ""thermometer graduated from 180\u00b0 to 215\u00b0 F. by 0\u00b702\u00b0""], ""other"": [""Inv. 1893-149""]}","{""object_names"": [], ""makers"": [], ""organisations/institutions"": [""Science Museum Group""], ""dates"": [], ""places"": [""Holborn, London, England, United Kingdom""], ""descriptions"": [""Surveying hypsometer""], ""other"": []}"
132,21,5,4,1,1,0,3,1,3,0,3,0,6,2,1,1,"{""object_names"": [""groma"", ""surveyor's cross"", ""stella"", ""pondera""], ""makers"": [""Municipal Museum, Ivrea, N. Italy""], ""organisations/institutions"": [""Municipal Museum, Ivrea"", ""Jahrb. d. Deutsch. Arch\u00e4olog. Instituts""], ""dates"": [""about 100 A.D."", ""100 A.D."", ""1901""], ""places"": [""Ivrea, N. Italy"", ""North Italy""], ""descriptions"": [""Carving of a groma"", ""Tombstone of a Roman \""Mensor,\"" L. Aebutius Faustus"", ""crude representation"", ""somewhat conventionalized perspective sketch, showing the two crossed arms of the \""stella,\"" with only two \""pondera\"" (weights) instead of the four usually suspended, one from each end of the \""stella.\"""", ""addition of the \""ferramentum,\"" or staff, to support the \""stella\"" is also depicted, passing through the intersection of the two arms of the latter."", ""In using such a groma, it would be set up so that one plummet hung over the station point, and one of the adjacent plummets lay in the direction from which the right angle was to be set off; a sight through the other adjacent plummet would then be taken from the station plummet.""], ""other"": [""Inv. 1923-492""]}","{""object_names"": [""Groma""], ""makers"": [], ""organisations/institutions"": [""Science Museum Group""], ""dates"": [], ""places"": [], ""descriptions"": [""photograph"", ""reconstruction drawing""], ""other"": []}"
133,21,5,2,1,1,0,2,1,1,0,3,1,9,1,3,1,"{""object_names"": [""Roman groma"", ""Reconstruction""], ""makers"": [""Professor Sch\u00f6ne""], ""organisations/institutions"": [""Jahrb. d. Deutsch. Arch\u00e4olog. Instituts""], ""dates"": [""1901""], ""places"": [""Eichst\u00e4tt, Bavaria"", ""Germany""], ""descriptions"": [""DRAWING OF A RESTORATION OF A SMALL GROMA."", ""Reconstruction based on find near Eichst\u00e4tt, Bavaria"", ""Another example of the Roman groma, found near Eichst\u00e4tt, Bavaria, has served as basis for Professor Sch\u00f6ne's reconstruction illustrated in this drawing."", ""The groma discovered consisted of an iron \""stella\"" mounted upon a \""ferramentum,\"" also of iron."", ""The ends of the arms of the stella are bent and transfixed by iron bolts, which served to attach a square wooden frame\u2014since perished\u2014to the \""stella,\"" and to carry the plumb lines."", ""The length of each side of the wooden framework was 35 cm., and the height of the \""ferramentum,\"" exclusive of the upper and lower axis pins, is 35\u00b75 cm."", ""This instrument was, therefore, a small type of groma, and was probably mounted upon a wooden tripod, as shown in the drawing, so that the \""stella\"" was at approximately the height of a man from the ground."", ""See Sch\u00f6ne, \""Das Visirinstrument der r\u00f6mischen Feldmesser,\""""], ""other"": [""N/A"", ""(15814)"", ""C 4 Inv. 1923-493""]}","{""object_names"": [""groma""], ""makers"": [], ""organisations/institutions"": [""Science Museum Group""], ""dates"": [], ""places"": [""Eichst\u00e4tt""], ""descriptions"": [""a surveyor's instrument used in Roman times""], ""other"": [""SMGIC:15814""]}"
134,21,12,1,2,1,0,3,1,2,2,2,5,8,2,4,0,"{""object_names"": [""REPRODUCTION OF A ROMAN GROMA""], ""makers"": [""Made in the Museum"", ""Dr. Della Corte""], ""organisations/institutions"": [""Museum"", ""Accademia dei Lincei""], ""dates"": [""1912"", ""1922""], ""places"": [""Via Abbonanza at Pompeii""], ""descriptions"": [""Plate III, Fig. 1, p. 56."", ""Made in the Museum During excavations in the Via Abbonanza at Pompeii, in 1912, under the direction of Cav. M. Della Corte, fragments of a Roman groma were discovered. These fragments were sufficiently preserved and complete to enable Dr. Della Corte to reconstruct the original instrument with a certainty not hitherto attained owing to the meagre data available."", ""The instrument exhibited has been constructed in accordance with the measurements and drawings supplied by Dr. Della Corte."", ""As previously reconstructed, the groma consisted of a cross, composed of two equal perpendicular arms intersecting at their centres, mounted upon a supporting staff (ferramentum), upon which the cross could revolve in azimuth: from the ends of the cross were suspended four plummets, through which sights were taken by the surveyor."", ""This reconstruction comprises all the foregoing portions, with the additional modification that the cross is not supported directly upon the staff, but is pivoted upon the outer end of a curved bracket, which is in turn mounted rotatably upon the head of the staff. This arrangement enables the centre of the cross to be set above the mark on a boundary stone, whilst the staff is driven into the ground beside the stone; also, sights could be taken through opposite, not adjacent, plumb lines without interference from the staff."", ""The wooden staff, which is nearly 2 metres long, terminates at its lower end in a fluted iron shoe, and is encircled at its upper extremity by a brass collar, along its upper and lower faces by curved brass strips, and terminating at the staff end in a brass collar and at the cross end in a brass pivot upon which the curved bracket is mounted."", ""The cross has a brass centre, and four tapered wooden arms, completely enclosed in thin iron sheeting and reinforced at their intersection by brass angle brackets."", ""Each plummet resembles its opposite in size and shape but differs from the neighbouring ones. The actual portions discovered included all the metal parts, with a few traces of wood fibres embedded therein. The total height of the instrument is alone considered problematical.""], ""other"": [""M. Della Corte's article \""Groma\"""", ""Monumenti Antichi, Accademia dei Lincei, Vol. XXVIII, 1922"", ""Inv. 1923-395"", ""S.M. 1828""]}","{""object_names"": [""Surveying groma"", ""groma""], ""makers"": [], ""organisations/institutions"": [""Science Museum Group""], ""dates"": [""1st century AD"", ""1-79 CE"", ""before 1923""], ""places"": [""Pompeii, Naples, Campania, Italy""], ""descriptions"": [""Reproduction of a Roman groma, based on one excavated at Pompeii"", ""Reproduction of a Roman groma""], ""other"": []}"
135,8,9,1,1,1,1,0,1,1,1,1,3,3,2,1,0,"{""object_names"": [""CROSS STAFF""], ""makers"": [""Baldantoni""], ""organisations/institutions"": [], ""dates"": [""towards the end of the 17th century""], ""places"": [""Ancona""], ""descriptions"": [""hollow brass sphere of 2\u00bd in. diam., with vertical great circle sighting slits cut every 45\u00b0 in its surface. It is used like the ordinary sight-rule cross staff for setting off angles of any multiple of 45\u00b0"", ""A socket fixed to the sphere serves to connect it to a stand."", ""probably made towards the end of the 17th century""], ""other"": [""Inv. 1889-22""]}","{""object_names"": [""Cross-head""], ""makers"": [""A. Baldantoni""], ""organisations/institutions"": [""Science Museum Group""], ""dates"": [""1690-1710""], ""places"": [""Ancona, Italy"", ""Marches, Italy""], ""descriptions"": [""Spherical cross-head"", ""Surveying cross-head; cross-head""], ""other"": []}"
136,12,12,1,1,1,1,1,1,2,2,0,4,6,2,1,1,"{""object_names"": [""CROSS STAFF""], ""makers"": [""Dollond""], ""organisations/institutions"": [], ""dates"": [""late 18th or early 19th century""], ""places"": [], ""descriptions"": [""two 6-in. brass sight rules fixed accurately at right angles to each other"", ""central screw thread for attaching it to a stand"", ""Backsights and foresights can be taken through either rule"", ""every vertical arm having both a slit backsight and a wire foresight"", ""mostly used in detail chain and offset surveying"", ""for setting the offset rod at right angles to the chain""], ""other"": [""Inv. 1921-81""]}","{""object_names"": [""Cross-head"", ""Surveying cross-head""], ""makers"": [""Dollond family""], ""organisations/institutions"": [""Science Museum Group""], ""dates"": [""1795-1805""], ""places"": [""London, England"", ""City of London"", ""London, Greater London, England"", ""United Kingdom""], ""descriptions"": [""Open cross-staff head with four fixed alidade sights"", ""cross-head""], ""other"": []}"
